{
  "id": "test_scholarship",
  "scholarship_name": "ScholarBridge Test Scholarship",
  "org_name": "ScholarBridge Test Organization",
  "source_url": "https://example.com/test-scholarship",
  "country": "International",
  "source_type": "test_fixture",
  "award_amount": 5000,
  "currency": "USD",
  "deadline": "2099-12-31",
  "award_year": 2099,
  "degree_levels": ["masters", "phd"],
  "eligible_nationalities": ["Any"],
  "eligible_visa_types": ["F-1", "J-1"],
  "fields_of_study": ["Computer Science", "Engineering"],
  "description": "This is a test scholarship record designed purely as a development fixture. It should never appear in production. It is used to test the loader and scoring functions.",
  "eligibility_text": "Must be a student in CS or Engineering. Must have a high GPA. Must have entrepreneurship experience.",
  "feature_manifest": {
    "total_features": 5,
    "features": [
      {
        "id": "degree_level",
        "label": "Eligible degree levels",
        "type": "enum",
        "student_field": "degree_level",
        "values": ["masters", "phd"],
        "required": true
      },
      {
        "id": "gpa",
        "label": "Minimum GPA",
        "type": "threshold",
        "student_field": "gpa",
        "min": 3.5,
        "required": true
      },
      {
        "id": "essay",
        "label": "Personal statement required",
        "type": "output",
        "required": true
      },
      {
        "id": "entrepreneurship",
        "label": "Entrepreneurship experience required",
        "type": "boolean",
        "student_field": "entrepreneurship_experience",
        "required": true
      },
      {
        "id": "age_limit",
        "label": "Age limit",
        "type": "range",
        "student_field": "age",
        "max": 35,
        "required": false
      }
    ]
  },
  "last_verified": "2026-06-09T00:00:00Z",
  "created_at": "2026-06-09T00:00:00Z",
  "updated_at": "2026-06-09T00:00:00Z"
}
