{
  "id": "aauw_international_fellowships",
  "scholarship_name": "AAUW International Fellowships",
  "org_name": "AAUW",
  "source_url": "https://www.aauw.org/resources/programs/fellowships-grants/current-opportunities/international/",
  "country": "International",
  "source_type": "foundation",
  "award_amount": 20000,
  "currency": "USD",
  "deadline": "2026-11-15",
  "award_year": 2026,
  "degree_levels": [
    "masters",
    "phd",
    "postdoc"
  ],
  "eligible_nationalities": [
    "Any"
  ],
  "eligible_visa_types": [
    "F-1",
    "J-1"
  ],
  "fields_of_study": [
    "Any"
  ],
  "description": "AAUW International Fellowships are awarded for full-time study or research in the United States to women who are not U.S. citizens or permanent residents.",
  "eligibility_text": "Applicants must be women, non-US citizens or PRs, holding a non-immigrant visa (F-1 or J-1 preferred). Must intend to return to their home country to pursue a professional career.",
  "feature_manifest": {
    "total_features": 5,
    "features": [
      {
        "id": "degree_level",
        "label": "Eligible degree levels",
        "type": "enum",
        "student_field": "degree_level",
        "values": ["masters", "phd", "postdoc"],
        "required": true
      },
      {
        "id": "gender",
        "label": "Female gender identity",
        "type": "enum",
        "student_field": "gender",
        "values": ["female"],
        "required": true
      },
      {
        "id": "essay",
        "label": "AAUW Fellowship Application Essays",
        "type": "output",
        "required": true
      },
      {
        "id": "transcripts",
        "label": "Official Academic Transcripts",
        "type": "output",
        "required": true
      },
      {
        "id": "recommendations",
        "label": "Three Letters of Recommendation",
        "type": "output",
        "required": true
      }
    ]
  },
  "last_verified": "2026-06-24T12:00:00Z",
  "created_at": "2026-06-24T12:00:00Z",
  "updated_at": "2026-06-24T12:00:00Z"
}
